Name,Equation number,Model - new table,Input variable,Output variables,Equation shape,Formule,Equation form,Zotero reference,IPCC risks,Input categories,Output categories,Latex fragment,Vensim,Vensim name
Total agriculture impact,A.1,FUND v.3.8,"Damage in agricultural production,Damage in agricultural production level ,Damage in agricultural production due to CO2 fertilisation",Total agriculture impact,,a1.png (https://v5.airtableusercontent.com/v3/u/30/30/1720548000000/JbHqhnapZ64ke60MLvoDeQ/TzjlBO2-vutLwMEMdZQzYka0Pb-Sq_DKJpaKjTJmiO_RauZhmJoNC2Fv5BE8rW6AzjxWbyO2rA2CBfVlKwGTpl-1kEgXPL0OENA4kt_a3DrdnxLH6ll84KkzMY04yulxNUK3N6jxbTrahwflGW83lw/-vHeF7kWiKwvoVZrUTQd_wYkyrrIbyYC3dAqAH-6Baw),,[image] ([pdf](zotero://open-pdf/library/items/4PTUKAWE?page=6&annotation=7NEFIDYW))  ,"Food production reduction,Food security reduction",Production,Production,"A_{t,r}=A_{t,r}^{r}+A_{t,r}^{l}+A_{t,r}^{f}",Oui,FUND total agricultural impact
Agriculture impact of the rate of climate change,A.2,FUND v.3.8,"Time,Region,Change in regional mean temperature,Parameter for impact of climate change on economic welfare ,Non-linearity parameter,Speed of adaptation parameter",Damage in agricultural production,,a2.png (https://v5.airtableusercontent.com/v3/u/30/30/1720548000000/W-8XzomDg-j2Ix3oAR3SDA/4I1QzGlpYd8-W4mZDG4dAkqDY7JE43_K_wkYtvm3IZltoPr89CEe-ViNxZwk0GcKCvmtqKww_AUzdbHXLhkX2w9c357ZBMvAk4zABKB4zV_7hiPUx03FsnAplaMbG-XjClsJ4HcR0jI5-tePe4SAIw/ZK-1BxPKr0UOXqIDWXfj3adyEaZ78mUUVW2HhmA4HtE),Elasticity,[image] ([pdf](zotero://open-pdf/library/items/4PTUKAWE?page=6&annotation=GDB5BXVY))  ,"Food security reduction,Food production reduction",", Temperature",Production,"A_{t,r}^{r}=\alpha_{r}\left(\frac{\Delta T_{t}}{0.04}\right)^{\beta}+\left(1-\frac{1}{\rho}\right)A_{t-1,r}^{r}",Oui,
Agriculture impact of the level of climate change,A.3,FUND v.3.8,"Time,Region,Change in regional mean temperature,Parameter related to warming of 2.5°C ,Parameter related to warming of 3.2°C ",Damage in agricultural production level ,,a3.png (https://v5.airtableusercontent.com/v3/u/30/30/1720548000000/vN3hnyHYhZavdZ5pWgoUIg/0lGGLLY0XMSbbtEFPUNbGxuuzHfYkibJ8YgVOyE1iooH3ORDR-ZVrXJIaKOTvqxnLZsnPQmmpDEO55B2cM5L3XZT0PXHyoEg7wRq_tMyzLuoE5fSd6JGahGH_e39pxStu2k-kPTUfYuaCUGPtrmIeg/nFGrzKtiFwAwXjSPQ3F4EBt73drlhC9nVtB6hgz995E),Quadratic,[image] ([pdf](zotero://open-pdf/library/items/4PTUKAWE?page=6&annotation=XSXBCZLF))  ,"Food production reduction,Food security reduction",", Temperature",Production,"A_{t,r}^{l}\,=\,\delta_{r}^{l}T_{t}\,+\,\delta_{r}^{2}T_{t}^{2}",Oui,"""FUND - agricultural impact of the level of climate change"""
Agriculture impact of fertilisation,A.4,FUND v.3.8,"Time,Region,Pre-industrial concentration of CO2,Atmospheric CO2 concentrations ,Parameter related to CO2 fertilisation",Damage in agricultural production due to CO2 fertilisation,,a4.png (https://v5.airtableusercontent.com/v3/u/30/30/1720548000000/L6MF6zSMdhan0RYn-GkPvg/udeL5Gt_WGXFg9szo8vX9Aegp5lnxhejg2OCp6ykzh0Q1mUbnAFmIm0yr1rEX8dsJRqVniT5z_xf_Sz_WMrVTimfWuwOhUf4X6kJGokL29FDZK1Po8yPGh03zq6Oc8DrvvX5Zk4ImCV6Xy6GGcsC_Q/Hksbkeq0xg0V_LGK9riGZDt7uvd9f8GwGKmABjZlccU),Logarithmic,[image] ([pdf](zotero://open-pdf/library/items/4PTUKAWE?page=7&annotation=9AKBR3NN))  ,"Food security reduction,Food production reduction",", CO2 concentration",Production,"A_{t,r}^{f}=\nu_{r}\ln\frac{G O2_{t}}{275}\,,",Oui,"""FUND - agricultural impact of the fertilisation"""
Agriculture production relative loss,A.5,FUND v.3.8,"Gross agricultural product,GDP in region r at time t ,Gross domestic product per capita,Time,Region,Income elasticity parameter",,,a5.png (https://v5.airtableusercontent.com/v3/u/30/30/1720548000000/iSOwcGhMLEkW0TxuuZCKIA/8gAUvCv4bH4Wou2MLqL_2tmzMcGEfptJuAhR7v5R_s6W68mJjy4wTitTftQAk1ka4fYepIaLeaZ8L0RV5jVXSIFWDbFf2JbC8t_M3bqe6L0hyqmU2VvtfWFrLvvY1QI3BDH6XgdfE2G--_fEAWcPXw/fDi-yzOd2HjDyadRdfcXkIRcJO0HtD_6LdnYcrCEL54),Elasticity,[image] ([pdf](zotero://open-pdf/library/items/4PTUKAWE?page=7&annotation=YE8XS39V))  ,"Food production reduction,Food security reduction","Production, GDP, ",,"\frac{G A P_{t,r}}{Y_{t,r}}=\frac{G A P_{1990,r}}{Y_{1990,r}}\biggl(\frac{y_{1990,r}}{y_{t,r}}\biggr)^{2}",Oui,
Forestry impact,F.1,FUND v.3.8,"Time,Region,Gross domestic product per capita,Global mean temperature ,Parameter for impact of climate change on economic welfare ,Income elasticity parameter ,Expert guess parameter ,Parameter for the effect of doubling atmospheric CO2 concentration on forest value ",Change in forestry consumer and producer surplus ,,f1.png (https://v5.airtableusercontent.com/v3/u/30/30/1720548000000/fzEapti_-CmHmZNcGtEqTA/0RrWNBxThWvx-VdxW-B4cih4ERb9FIlorfKR8ZWbRcIMx0ob4ovAHNnCHUGHMFX8Yat__ZDR8cmJYchtNA8wP1KrImeyw_YWonoLmAZ72r8N8Y49nfexgZA-LNpmSNlMvctufTLglCPlSpVrvZysOA/rd8T_mu04d9O9Vmh19sr3TmUiq4auWkxNOjFwGXfnNg),Elasticity,[image] ([pdf](zotero://open-pdf/library/items/4PTUKAWE?page=8&annotation=GWFZADWT))  ,Loss in terrestrial ecosystem,", GDP, Temperature",Production,"F_{t,r}=\alpha_{r}\left(\frac{y_{t,r}}{y_{1990,r}}\right)^{s}\left(0.5\left(\frac{T_{t}}{1.0}\right)^{\beta}+0.5\gamma\ln\left(\frac{C O_{2,t}}{275}\right)\right)",Oui,
Water resources impact,W.1,FUND v.3.8,"Time,Region,Gross domestic product per capita,Population in region r at time t ,Global mean temperature ,Parameter for benchmark impact ,Parameter for economic growth response ,Parameter for population growth response ,Parameter for impact response to warming ,Parameter for technological progress ",Change in water resources ,,w1.png (https://v5.airtableusercontent.com/v3/u/30/30/1720548000000/uX6WSFXMIdBmnR7_l1pevg/4ObfMWjCqlm7P_W-9akqsYipUTgzhq27tEDyFl1oH2R1-hXlFAhQUUNzQ6b5KnYsOc9qdIZT90lWvkmoWT-UZ328eixjk0SO4WorMO_JI0rMGmfnSH7TrTFCtjppKBRe7zbePBSwgxI6NkPasoPZvw/qcWMNAagHhD8sSVWyA4HdxHUYVzOBd5RrKXIRHGwtYA),Elasticity,[image] ([pdf](zotero://open-pdf/library/items/4PTUKAWE?page=8&annotation=FCPZZUZT))  ,"Loss in freshwater ecosystem,Water security reduction,Water scarcity",", GDP, Population, Temperature",,"W_{t,r}=\operatorname*{min}\left\{\alpha_{r}Y_{1990,r}(1-\tau)^{\prime-2000}\left(\frac{y_{t,r}}{y_{1990,r}}\right)^{\not p}\left(\frac{P_{t,r}}{J_{1990,r}}\right)^{\not p}\left(\frac{T_{t}}{1.0}\right)^{\gamma}\frac{Y_{t,r}}{1.0}\right\}",Oui,
Space heating impact,E.1,FUND v.3.8,"Time,Region,GDP in region r at time t ,Change in regional mean temperature,Gross domestic product per capita,Population in region r at time t ,Parameter for benchmark impact ,Income elasticity of space heating demand ,Autonomous Energy Efficiency Improvement ",Decrease in expenditure on space heating ,,e1.png (https://v5.airtableusercontent.com/v3/u/30/30/1720548000000/3PRo-bdUnGb1QGd2BmYEyA/PLCFvigA4-AUoxjoOD4tenCwXO_NsQ7_4WQ01ae-m4xrJ5tGwYMvqEGBxtrbczWJDT8haiJEbdF1N_xR5gA3TPWZyiFZ2Qby_V1NbtqiJQJ2t6FvMNgeenm74GtkpN7Xn7VE8m3NAqk7MA1OMLUcgQ/DZDMZMktcftyZkcJEgULJp_hMFd7x2LH95bPgUecVcc),Elasticity,[image] ([pdf](zotero://open-pdf/library/items/4PTUKAWE?page=9&annotation=L5D97PP2))  ,,", GDP, Temperature, Population",Consumption,"B_{t}=\operatorname*{max}\left\{\frac{B_{0}}{100},B_{t-}\left(1-\rho-\gamma\frac{\Delta T^{2}}{\tau^{2}}\right)\right\}",Oui,
Space cooling impact,E.2,FUND v.3.8,"Time,Region,GDP in region r at time t ,Change in regional mean temperature,Gross domestic product per capita,Population in region r at time t ,Parameter for economic growth response ,Income elasticity of space heating demand ,Autonomous Energy Efficiency Improvement ",Increase in expenditure on space cooling ,,e2.png (https://v5.airtableusercontent.com/v3/u/30/30/1720548000000/2lA_HqNrjvOzjqVE-J_RMQ/oKfeO71HIDXsB1ESmSLA4hCdF5N6RMzmFbZ3gg0d46eQEdnmEquB1oZyhN5IOaf-o8gMZjxxaguJXc-UT_eCRPgL6pEIFaTZ_Sg-28f3cnDE2qNYcRMUE0jnxXhktO8m4Dm7zJAdR9-IXE20wgRerA/UreECkNypnFCwd0q-0YcSvQUdtd2dtZA9P4bBlPEf9w),Elasticity,[image] ([pdf](zotero://open-pdf/library/items/4PTUKAWE?page=10&annotation=9HNIT94Y))  ,"Extreme heat,""Heat, malnutrition and harm from wildfire""",", GDP, Temperature, Population",Consumption,"S C_{t,r}=\alpha_{r}Y_{1990,r}\left(\frac{T_{t}}{1.0}\right)^{\beta}\left(\frac{y_{t,r}}{y_{1990,r}}\right)^{\epsilon}\left(\frac{P_{t,r}}{P_{11990,r}}\right)\right/\prod_{s=1,900}^{t}4E E I_{s,r}",Oui,
Potential cumulative dryland impact,SLR.1,FUND v.3.8,"Time,Region,Dryland loss due to one metre sea level rise ,Sea level rise above pre-industrial levels ,Parameter calibrated to a digital elevation model ,Maximum dryland loss in region ",,,slr1.png (https://v5.airtableusercontent.com/v3/u/30/30/1720548000000/N5TIWXkeHYzY-xVbRpsNHA/KWjpA-zdWb4RHEFeWwTLElrR3mMdcIwY9ywnpBesvhGqXU8OrU-5hojgLwlZpJLZAJVR2XwTOs4lPFCECgfvW5FMuBUNYeQoRZywm4at7JaqqSeIzb03JRe2zA4GJxkfHy93Rxg_vJL8VO4f0M-dKQ/N-swKWtY26dPcsG1tEt9DYE7mNeGbtJ8mDtlmjwI4ek),Linear,[image] ([pdf](zotero://open-pdf/library/items/4PTUKAWE?page=11&annotation=8NBHZVUR))  ,Loss in terrestrial ecosystem,", Sea level rise",,"\overline{{{C D}}}_{t,r}=\operatorname*{min}[\delta_{r}s_{t}^{\gamma_{r}},\zeta_{r}]",Oui,
Potential dryland loss without protection,SLR.2,FUND v.3.8,"Potential cumulative dryland loss without protection ,Actual cumulative dryland loss ",Potential dryland loss without protection ,,slr2.png (https://v5.airtableusercontent.com/v3/u/30/30/1720548000000/Ca7XuLuSClweK8Oap9YNsg/b6gETxH7BaVg9s9SHRzuT33xpq1xwlX1G2A7Fu76LgiZ8g09yCw_BnGaCLC1TxuUXhSyYBEJ_f7ZsL9nP87AkHUajXwyetTrThftr8zDx7VP31nxikwBJ7XCmN2uXGDhptGPScCej8i1YPuJ5fppwQ/IFhkfunQPLwu9VmfXStZvMrOQ_jrCG3rag2gsfiNBkw),Linear,[image] ([pdf](zotero://open-pdf/library/items/4PTUKAWE?page=11&annotation=U2LKEDGJ))  ,Loss in terrestrial ecosystem,", Natural capital",,"\overline{{{D}}}_{t,r}=\overline{{{C D}}}_{t,r}-C D_{t-1,r}",Oui,
Actual dryland loss in the current year,SLR.3,FUND v.3.8,"Fraction of the coastline protected ,Potential dryland loss without protection ",Dryland loss in year ,,slr3.png (https://v5.airtableusercontent.com/v3/u/30/30/1720548000000/b576jchsUJRAtookbSWVTg/9CbRH22ApC9KYw4VHNPIJxLqjevKYTd_ALqlE_v2Q5TtmE3oG7C9Wc_M6FKSOeKIwT6zShDjpOC0_6ydgB55CPAeQ1FUzu8fDby6cABVfvimp44NCzKydIGU6RYH2v63EUeloLLXyNslCSqcpedJoQ/UF5q0jyfoloxQjV1XjZren78i08auw4Ph61tkjg6B5g),Linear,[image] ([pdf](zotero://open-pdf/library/items/4PTUKAWE?page=11&annotation=XPNAQZ8K))  ,Loss in terrestrial ecosystem,,,"D_{t,r}=\left(1-P_{t,r}\right)\overline{{{D}}}_{t,r}",Oui,
Actual cumulative dryland loss,SLR.4,FUND v.3.8,"Actual cumulative dryland loss ,Dryland loss in year ",Actual cumulative dryland loss ,,slr4.png (https://v5.airtableusercontent.com/v3/u/30/30/1720548000000/IkK4BqLx5tzCYRUXimP-JQ/zBBKiOAlh6PoTevpFk7xwKxG1q1HcOmnkbyGEgV52ukfDqScu2z9k2ljMoLrkpIjVqlGZYsDWvZNi_hXR0MngKUxJ01qJerUyLjsoy640HNsOJyTSwSlI26OrRYBgU3ebIH_T037A-iEmu1_inRyIw/aXzOrUU9-Ti7grBwwpD_riiSS5Lt00nxkgCli6RZsv8),Linear,[image] ([pdf](zotero://open-pdf/library/items/4PTUKAWE?page=11&annotation=62EHGDDF))  ,Loss in terrestrial ecosystem,"Natural capital, ",Natural capital,"{\cal C}D_{t,r}=C D_{t-1,r}+D_{t,r}",Oui,
Value of dryland,SLR.5,FUND v.3.8,"Time,Region,Unit value of dryland ,GDP in region r at time t ,Area ,Parameter ,Normalisation constant ,Income density ",Unit value of dryland ,,slr5.png (https://v5.airtableusercontent.com/v3/u/30/30/1720548000000/EH73beJh4gAn76-LBt7EaQ/lUkON46ewBfJtd-_abavWp6-sjM6PKqDu_f-rIapCen-cIb7pYlHVgeiFtVWfvZ0v0xjUxgCYY15G8PhHZXcwjPkSOH-YlygnUBV67y9jMDkpV-88FcO5RFw4tI919xBLtG6R53JnlTlua-dMMwvtw/t-w0N-_Krcncd0Em49PHQeEC51SlkU4vuYmZy6YNpdI),Elasticity,[image] ([pdf](zotero://open-pdf/library/items/4PTUKAWE?page=11&annotation=C2QI8ZFD))  ,Loss in terrestrial ecosystem,", GDP",,"V D_{t,r}=\varphi\!\left({\frac{Y_{t,r}/A_{t,r}}{Y A_{0}}}\right)^{\!\!6}",Oui,
Wetland loss,SLR.6,FUND v.3.8,"Time,Region,Fraction of coast protected against sea level rise ,Sea level rise above pre-industrial levels ,Parameter for annual unit wetland loss due to sea level rise ,Parameter for annual unit wetland loss due to coastal squeeze ",Wetland loss at time ,,slr6.png (https://v5.airtableusercontent.com/v3/u/30/30/1720548000000/ZojvsWSBoF7V_I6apCoW6g/4bARV5a-FVv8bhe--y-_t7PJ5V6SPaoP9_V20Ek36GhNOuknPDFBF0pySEcJC9IFcvd4qBzszqW5R_IRk0rP2joD-VefoJ7I_XLYR7_rvTnA3cHCaeiiAJY1awRwg_zOkcqXtIEPfBcyMwgNKus3sQ/VcdlalYerod1w7xYwCw2wJQJMXcf8vfPuqVvqqvIGfs),Linear,[image] ([pdf](zotero://open-pdf/library/items/4PTUKAWE?page=12&annotation=IICHUVN9))  ,Loss in freshwater ecosystem,", Sea level rise",,"\widehat{\mathcal{W}_{t,r^{\prime}}}\longrightarrow C\mathcal{O}_{r^{\prime}}^{S}\triangle\mathsf{A}_{t}\dots C\mathcal{O}_{r^{\prime}}^{M}\mathcal{D}_{t,r^{\prime}}\triangle\mathsf{A}_{t}",Oui,
Cumulative wetland loss,SLR.7,FUND v.3.8,"Cumulative wetland loss ,Total amount of wetland exposed to sea level rise ,Wetland loss at time ",Cumulative wetland loss at time ,,slr7.png (https://v5.airtableusercontent.com/v3/u/30/30/1720548000000/ZicS1Y_opdJB8a8sksKn2g/C42v-fw7FLmmP9_ijZXNer2veObY1RaV_bT663uDYCkCffPYIHOXolNJ8vsc3OkTJN7sfPQ7qSl2ovynHDewV3gj9pUvYLpCulxRuY6Oo9iW09iOZq2piurfjtZ-5dOhcPOVkisH4B81pZUwKicC8A/eYyvbucSlXxIm9FFXzq4vDgsXIcIoaUqOYzD3CcUU8w),Linear,[image] ([pdf](zotero://open-pdf/library/items/4PTUKAWE?page=12&annotation=E9BCWYSC))  ,Loss in freshwater ecosystem,,,"{\mathcal W}_{t,r}^{C}\ --\left.\mathrm{Im}^{*}\!\right.\left(\left.{\mathcal W}_{t-1,r}^{C}\right.\rightarrow\mathcal W\right._{t-1,r}^{}\left.\!-\frac{}{}_{,r}\right.\mathcal W\right._{r}^{}\frac{\lambda}{\sqrt{}_{r}^{}}\right)",Oui,
Wetland value,SLR.8,FUND v.3.8,"Time,Region,Gross domestic product per capita,Population density ,Cumulative wetland loss at time ,Total amount of wetlands in 1990 ,Income elasticity of wetland value ,Normalisation constant ,Normalisation constant ,Population density elasticity of wetland value ,Size elasticity of wetland value ",Wetland value at time ,,slr8.png (https://v5.airtableusercontent.com/v3/u/30/30/1720548000000/xiQW7M8eLKOcXK_pWG13nQ/r7l_eYoyNBERlEvZ1QY_cxQkRLVccQVG-2iHYjpu948-MuUO_EezoBrQkgTkGdGSoahSUKX5sqEiNillBZZdYqFQXX-CYH79mV5HAJCkWqaFuTXoopjZs7CwjaJA_blP33TpkMOw-SrGKugd7UR53A/EakNM0HKZ7QdWJBh49XFNC3bEPzLzM4oA-Nt6JxOY-s),Elasticity,[image] ([pdf](zotero://open-pdf/library/items/4PTUKAWE?page=12&annotation=RZLH5GJG))  ,Loss in freshwater ecosystem,", GDP, Population",,"V W_{t,r}=\alpha\left(\frac{y_{t,r}}{y_{0}}\right)^{\beta}\left(\frac{d_{t,r}}{d_{0}}\right)^{\gamma}\left(\frac{W_{1990,r}-W_{t,r}^{C}}{W_{1990,r}}\right)^{\delta}",Oui,
Level of protection,SLR.9,FUND v.3.8,"Net present value of protection if whole coast is protected ,Net present value of the wetlands lost due to full coastal protection ,Net present value of land lost without any coastal protection ,Net present value of wetland lost due to coastal squeeze if whole coast is protected ",Fraction of coastline to be protected ,,slr9.png (https://v5.airtableusercontent.com/v3/u/30/30/1720548000000/ahZgMRwzW70zOLRrdsyD1g/LBvqM7s_Rc8kjScDkUi-vF4Ay53gMHKRxTxLjNAUNWh2JAGdgzN8EzAP5sMZlREFE-WN9AOPyKocWZlyA9eGOFh9Fdg0Tc_KtELodORRfhwBiT_tFdNyxIg9Y4v7bh9l3QshaJEkVeE0UBPLp1ev9Q/dHcvUGZxEfQysd_PoVNdYXpfJP-bDQHmLE8aZ-oASAg),Linear,[image] ([pdf](zotero://open-pdf/library/items/4PTUKAWE?page=13&annotation=T5RHM6IP))  ,Coastal flooding / storm,,,"P_{t,r}=\operatorname*{max}\left\{0,1-\frac{1}{2}\left(\frac{\mathrm{NPV}V P_{t,r}+\mathrm{NPV}V W_{t,r}}{\mathrm{NPV}V D_{t,r}}\right)\right\}",Oui,
Net present cost of protection,SLR.10,FUND v.3.8,"Time,Region,Annual unit cost of coastal protection ,Sea level rise above pre-industrial levels ,Growth rate of per capita income ,Rate of pure time preference ,Consumption elasticity of marginal utility ",Net present costs of coastal protection at time ,,slr10.png (https://v5.airtableusercontent.com/v3/u/30/30/1720548000000/6-jSJ9ly0EnIRyjdCf-3mQ/ZRvfF5JSVYXRoO9CDHodikPiFVAw42nQFgCjFiTz79bUY7GNDCoWjFNAcRPqBcxyV3n0fb_ldHhj2uPEVyPCDzzaTrv8gZjxriR3y0OxeR926NZrnnAsIqw6nKHRYh9cyEqlanxAYrtkAa6XFFSbOw/L-0-dCcopq1torev9RjgRmv7KM8Xg9ipJYaJl41hskY),Linear,[image] ([pdf](zotero://open-pdf/library/items/4PTUKAWE?page=14&annotation=MW95T7K8))  ,Coastal flooding / storm,", Sea level rise, GDP, Parameter, Consumption",,"\mathrm{NPV}{\cal P}_{t,r}=\sum_{s=t}^{\circ}\Biggl(\frac{1}{1+\rho+\eta g_{t,r}}\Biggr)^{s-t}\pi_{r}\Delta S_{t}=\frac{1+\rho+\eta g_{t,r}}{\rho+\eta g_{t,r}}\pi_{r}\Delta S_{t,s}",Oui,
Net present cost of wetland loss,SLR.11,FUND v.3.8,"Time,Region,Annual unit wetland loss due to full coastal protection ,Sea level rise above pre-industrial levels ,Growth rate of per capita income ,Population growth rate ,Growth rate of wetland ,Rate of pure time preference ,Consumption elasticity of marginal utility ,Income elasticity of wetland value ,Population density elasticity of wetland value ,Size elasticity of wetland value ",Net present value of wetland loss at time ,,slr11.png (https://v5.airtableusercontent.com/v3/u/30/30/1720548000000/t4BFrpxCeKSd_bv3RqSJ-g/O0XiCur8x0YA7uTCStXVu1jZpMvst52nobzfI9a5qAOOP0ydou6jMfYaxB5sGVR9kl3Pj1hDdH2WGqLob-Ilzz3fawP26tuJY8IARjFzrOVpaTJn7jtqn_FlTEDI4MmG2tBg8F-xbIXlZJCDqHz6Bw/5Rv6dT0khqjh9SAsTMEwDGV5Y8OkEZeX57Ly18QPh7I),Linear,[image] ([pdf](zotero://open-pdf/library/items/4PTUKAWE?page=14&annotation=Z6DEIBXE))  ,Loss in freshwater ecosystem,", Natural capital, Sea level rise, GDP, Population, Parameter, Consumption",,"\left.N P V V W_{t,r}=\sum_{s=t}^{r}W_{t,r}V W_{s,r}\left(\frac{1}{1+\rho+\eta g_{t,r}}\right)^{s-t}=",Oui,
Net present cost of dryland loss,SLR.12,FUND v.3.8,"Time,Region,Current dryland loss without protection at time ,Current dryland value ,Growth rate of per capita income ,Rate of pure time preference ,Consumption elasticity of marginal utility ,Income elasticity of dryland value , Current income density growth rate ",Net present value of dryland loss at time ,,slr12.png (https://v5.airtableusercontent.com/v3/u/30/30/1720548000000/5PK6eB8w-cWwx1Re2pSnag/uHdvFFG9xLeerQVE1hy5JbpkWnWVB8qyue2CBEI8S3YW8k8_0-QmDMIgYF1jlW_qDxe9ZTCkAtl15n45LkjcVEVaAwh899Ei6_-wx_rzSBC81LmCscbXBt6NOuSYHjSzd8ZlHPEXQ4A84KwyjjPtSA/L_YJ2T1GBnOMP5R7UKRP_Wmw8blj8kZdmJEnR8v9bRs),Linear,[image] ([pdf](zotero://open-pdf/library/items/4PTUKAWE?page=15&annotation=S6374B6G))  ,Loss in terrestrial ecosystem,", Natural capital, GDP, Parameter, Consumption",,"{\mathrm{NPV}}U_{t,r}=\sum_{s=t}^{\infty}{\overline{{D}}}_{t,r}V D_{t,r}\left({\frac{1+\epsilon d_{t,r}}{1+\rho+\eta g_{t,r}}}\right)^{s-t}={\overline{{D}}}_{t,r}V D_{t,r}{\frac{1+\rho+\eta g_{t,r}}{\rho+\eta g_{t,r}-\epsilon d_{t,r}}}\ .",Oui,
Ecosystem loss,E.1,FUND v.3.8,"Time,Region,Gross domestic product per capita,Population in region r at time t ,Change in regional mean temperature ,Number of species ,Parameter ,Parameter ,Parameter ,Parameter for number of species ",Value of the loss of ecosystems at time ,,e.1.png (https://v5.airtableusercontent.com/v3/u/30/30/1720548000000/3cy-Z87nz-9WMaxzlF3tLg/sHRDXjhhzHSBtMat42HY4_VyaTj-XfT5wizysFfRmpHRbmoeeXV1K6HcafjVoQz1T_Rz48gBZvrGvAsZMMDb1mekHvUgy051sP9kGalITCTsELSYLm_c5YmrQh6mxRzN5tdLps5dqvr0WOzJdXgTRA/HP5vjjz7Q7MIM1MYTJuwtc7AJInhrBW_0VY_A9AfPMc),Elasticity,[image] ([pdf](zotero://open-pdf/library/items/4PTUKAWE?page=16&annotation=USHT735A))  ,Loss in terrestrial ecosystem,", GDP, Population, Temperature",,"E_{t,r}=\alpha P_{t,r}{\frac{y_{t,}^{\prime}{\cal Y}_{y}^{b}}{1+{\bf y}_{t,r}{\cal Y}_{y,r}}}{\frac{\Delta{\cal T}_{r}}{1+{\bf\bar{\Delta}}{2}{\cal Y}_{\tau}^{\prime}}}\bigg(1-\sigma+\sigma{\frac{B_{0}}{B_{t}^{\prime}}}\bigg)",Oui,
Number of species,E.2,FUND v.3.8,"Number of species ,Parameter ,Parameter ,Change in regional mean temperature ",Number of species ,,e.2.png (https://v5.airtableusercontent.com/v3/u/30/30/1720548000000/9BAYFrfnYBAIL5-RexqYLg/f5_7d9AbXpQVuYcTYhg1ZPLdkKMkSfnFoBYDvrX2_8SZ5dBWFZRanoQXfginRVKgVOM80wRbOT1uaFM-9sFujJGjOzpJAkKjsNeP911yRGrNbX2lct_bYNeewH5nzwWJ-63FGwq6WcDcGlPtLKDY9A/YXboCdSNxtdOMBIaiFkKXsehdVv81s2IRw3GthKFxx4),Elasticity,[image] ([pdf](zotero://open-pdf/library/items/4PTUKAWE?page=16&annotation=C8CYP6ED))  ,Loss in terrestrial ecosystem,", Temperature",,"S H_{t,r}=\alpha_{r}Y_{1990,r}\frac{\mathrm{atan}\,T_{t}}{\mathrm{atan}\,1.0}\biggl(\frac{y_{t,r}}{y_{1990,r}}\biggr)^{\epsilon}\biggl(\frac{P_{t,r}}{P_{1990,r}}\biggr)^{\epsilon}\biggl\langle\prod_{s=19900}^{t}\biggr\}^{\epsilon}\frac{\ln^{2}{\pi^{2}\pi^{2}\pi^{2}\pi^{2}\pi^{2}\pi^{2}\rangle_{t}}\,\biggl(\frac{y_{t,r}}{p_{t}-\epsilon_{r}^{2}\sqrt{2\pi_{t}\pi_{t}}^{2}\biggr)^{2}}{\epsilon_{t}^{2}-\pi_{t}^{2}\pi_{t}^{2}\pi_{t}^{2}\pi_{t}^{2}\pi_{t}^{2}\pi_{t}^{2}-\biggl)_{t}^{2}}_{t}\,{\epsilon_{t}{t}{t}{\mu}}\,\biggr)\,\,\rho_{\biggr)\,\,\frac{t}\,\biggl(\biggr",Oui,
Human health : diarrhoea,HD.1,FUND v.3.8,"Region,Population in region r at time t ,Time,Gross domestic product per capita,Regional mean temperature in degrees Celsius ,Rate of mortality from diarrhoea in 2000 in region r ,Income elasticity of diarrhoea mortality ,Parameter for non-linearity of response of diarrhoea mortality to regional warming ",Number of additional diarrhoea deaths ,,hd1.png (https://v5.airtableusercontent.com/v3/u/30/30/1720548000000/3FlBUjodGsLl9bf-8a073w/T9H-8FxqOPHD5mP5QOcgtrPZy0JFwoNDFToNyVhH0d4d8p7Fe8vILdGGHbchtcRm5tCMqKj9JFALLlTkHqCglxebnM-EC7u1zqd4qTY2Bmfglhja9iwCdUeSARD8AdY-znKhI2_wxdKbWZvAJd4yxw/2JzNxCgKG6Dt6JlypjUU4j6w8mbboXRXQzrNl8vzEIU),Elasticity,[image] ([pdf](zotero://open-pdf/library/items/4PTUKAWE?page=16&annotation=IVEG9QJP))  ,"Food-borne diseases,Water-borne diseases",", Population, GDP, Temperature, Mortality",,"D_{t,r}^{d}=\mathcal{A}_{r}^{d}P_{t,r}\left(\frac{\mathcal{V}_{t,r}}{\mathcal{V}_{1990,r}}\right)^{s}\left(\frac{T_{t,r}}{\mathcal{V}_{p r e-i n d u s t r i a l,r}}\right)^{p}",Oui,
Human health : vector-borne diseases,HV,FUND v.3.8,"Climate-change-induced mortality due to disease c in region r at time t ,Mortality from vector-borne diseases in 1990 in region r ,Time,Region,Vector borne disease,Parameter indicating benchmark impact of climate change on vector-borne diseases ,Regional mean temperature in degrees Celsius ,Gross domestic product per capita,Change in regional mean temperature,Parameter for degree of non-linearity of mortality in warming ,Income elasticity of vector-borne mortality ",Number of additional deaths from vector-borne diseases ,,hv.png (https://v5.airtableusercontent.com/v3/u/30/30/1720548000000/cTdD3bSgDxdOT9QRDPTUUg/D1U2qNrkjW8iK1TR0NGYMPetBcqbrZl8Y9It-SyioC2a4pRjJC6UEP9C74jnqXbLiB0Ln9bGqyFO3OSoNX4Ejodij4ThC5EhcE_lSPXyBJUowAN8TFbkmZuB4ufr4sUEl2IUZ9vvOhw3fkH4CGJg0w/E1dqVVSE4LxijqxtqHEHQXY_-jtGRPwqoQ0-WVhyEEs),Elasticity,[image] ([pdf](zotero://open-pdf/library/items/4PTUKAWE?page=17&annotation=XNSE353L))  ,Infectious diseases,", Temperature, GDP",,"D_{t,r}^{\nu}=D_{1990,r}^{\nu}Q_{r}^{\nu}\left(T_{t}-T_{1990}\right)^{\beta}\left(\frac{y_{t,r}}{y_{1990,r}}\right)^{\gamma}",Oui,
Human health : cardiovascular and respiratory mortality,HC.1,FUND v.3.8,"Index for the disease ,Current temperature of the hottest or coldest month in the country ",Change in mortality due to one degree global warming ,,hc1.png (https://v5.airtableusercontent.com/v3/u/30/30/1720548000000/aDNFfJuL6HqzfpVTELr5Og/uqAvGIgtkLSBVR8QJBFlN1Eq63SNp1MDr9KceR39PsUfwwARD0CLv-nYCkSPIHIaIkkvja6NrGSQl6FNS7Wf1p2uymt98YKMGcnoqN5OY9SxeJZrcckeyYLoFj750r22792L17hhPwcWDDiZ1-Ucdg/ylMmCqVOQ053fHLCQsBjLjiG1N5twjEtp7uxwN_s80Q),Linear,[image] ([pdf](zotero://open-pdf/library/items/4PTUKAWE?page=18&annotation=CL2YMIC5))  ,Extreme heat,,Mortality,{\cal D}^{c}=\varrho^{c}+\beta^{c}{\cal I}_{\cal B},Oui,
Human health : regional cardiovascular mortality,HC.2,FUND v.3.8,"Region,Time,Change in regional mean temperature",Climate-change-induced mortality due to disease c in region r at time t ,,hc2.png (https://v5.airtableusercontent.com/v3/u/30/30/1720548000000/Ryq7LLCNGt0mVhnp8xwXTQ/Nn4t6ZOtPTvAouwNQvBEXmLeysi_u0wSNrmh9bcV2vzr59FkQRLg7_XTcFE4T9JNaxE18fxUZlW-YkSQ9LbP19uhXiHpJhZYwf8oWLuRtHaTsBMEAjrwpj8TmtaFWrf8pxj51IVVGdPd-EHmD0bwPw/1gVMdtmDtoSJEWBKkdnTiD6TUMHCbdAZNiovi0x00Kw),Quadratic,[image] ([pdf](zotero://open-pdf/library/items/4PTUKAWE?page=18&annotation=AWVUZ27W))  ,Extreme heat,", Temperature",,"D_{t,r}^{c}=\alpha_{r}^{c}T_{t}^{2}+\beta_{r}^{c}T_{t}^{2}",Oui,
Human health : heat-related mortality,HC.3,FUND v.3.8,"Gross domestic product per capita,Population density ,Time,Region",Fraction of people living in cities ,,hc3.png (https://v5.airtableusercontent.com/v3/u/30/30/1720548000000/boTQytDIRvQ0HFwAB9i9Nw/XlozpsoYyuc6sYNogDThgW3MVOHHTKgOvfO5P-F80RaJ359LmbVH8nbxey3Rvqk7baX_QHDYnyi1neyVHPx75Lh0KA0W14XvuU2vNv6s2sY_Ueaw78bkjTIDHQpM5rD9VSERa3RPE6aE7lrNpqAAtw/-sJCRmoS04oaG9Ckasj7rEuNuWecinSMpfwAEZuKBdw),,[image] ([pdf](zotero://open-pdf/library/items/4PTUKAWE?page=19&annotation=BCCGDXPN))  ,Extreme heat,"GDP, Population, ",Population,"U_{t,r}=\frac{\alpha\sqrt{y_{t,r}}+\beta\sqrt{P D_{t,r}}}{1+\alpha\sqrt{y_{t,r}}+\beta\sqrt{P D_{t,r}}}",Oui,
Extreme weather : tropical storms damage,TS.1,FUND v.3.8,"Time,Region,GDP in region r at time t ,Current damage as a fraction of GDP ,Gross domestic product per capita,Income elasticity of storm damage ,Parameter indicating how much wind speed increases per degree warming ,Change in regional mean temperature,Parameter for the power of the wind in the cube of its speed ",Damage due to tropical storms in region r at time t ,,ts1.png (https://v5.airtableusercontent.com/v3/u/30/30/1720548000000/QKES7oYJeSpJpRkiQamg2g/ELbG0-n3w3AgbELEU1MnCFUdhEHiC-mtBMoV8H5GDJCn6rc0lBs7evihyaFg9g2tRMOoLtr6PgY9mRxbKTQm_iMM013fnR2irtBIOoUPC3MrrRBSr-dZnZGQ1uUp-NE-Gkk-tjajqGoMG3JdVTPRIQ/8ABL_QKoOi4En9X5KF0xjjcNT8raxAkcoIjfuDqpnWk),Elasticity,[image] ([pdf](zotero://open-pdf/library/items/4PTUKAWE?page=19&annotation=TNF9KWNC))  ,"Inland flooding,Coastal flooding / storm,Damages to infrastructure,Damages to key economic sectors",", GDP, Wind, Temperature",GDP,"T D_{t,r}=\sigma_{r}Y_{t,r}\left(\frac{\vartheta_{t,r}}{\vartheta_{1990,r}}\right)\left[\left(1+\rlap{\textstyle{\mathcal{D}}}{\mathcal{D}}_{t,r}\right)^{\gamma}-1\right]",Oui,
